# ALTER DATABASE (Stage 13): the two versioning options parse, persist, and
# gate. Same-session results are unchanged by RCSI (a session always sees its
# own writes and everything committed); the cross-session semantics live in
# the session tests.

statement ok
ALTER DATABASE CURRENT SET READ_COMMITTED_SNAPSHOT ON

statement ok
ALTER DATABASE CURRENT SET ALLOW_SNAPSHOT_ISOLATION ON, READ_COMMITTED_SNAPSHOT ON

# Only the recognized options are accepted; anything else is a syntax error,
# never a silent no-op (these options change what concurrent readers see).
statement error
ALTER DATABASE CURRENT SET RECOVERY SIMPLE

statement error
ALTER DATABASE CURRENT SET READ_COMMITTED_SNAPSHOT MAYBE

# ALTER DATABASE is not allowed inside a multi-statement transaction (226).
statement ok
BEGIN TRANSACTION

statement error
ALTER DATABASE CURRENT SET READ_COMMITTED_SNAPSHOT OFF

statement ok
ROLLBACK

# Ordinary single-session work behaves identically under RCSI: own writes and
# committed state are always visible.
statement ok
CREATE TABLE opt (id INT NOT NULL PRIMARY KEY, v INT)

statement ok
INSERT INTO opt VALUES (1, 10), (2, 20)

statement ok
UPDATE opt SET v = 11 WHERE id = 1

query II rowsort
SELECT id, v FROM opt
----
1 11
2 20

statement ok
BEGIN TRANSACTION

statement ok
UPDATE opt SET v = 12 WHERE id = 1

# The updating transaction reads its own uncommitted write.
query I
SELECT v FROM opt WHERE id = 1
----
12

statement ok
ROLLBACK

query I
SELECT v FROM opt WHERE id = 1
----
11

statement ok
ALTER DATABASE CURRENT SET READ_COMMITTED_SNAPSHOT OFF, ALLOW_SNAPSHOT_ISOLATION OFF

query I
SELECT v FROM opt WHERE id = 1
----
11
